UserID,Position,TupleID,Choice,Reason,User ID,Tuple Index,Tuple Name,Cluster,Pair Type,Original V1 Metric,Original V2 Metric,Swapped,Actual_Choice
UE064AED19,1,4,V1,"I found V1 more legible, whereas V2 did some questionable things (e.g. defining ""input = sys.stdin.readline"" for P1).",UE064AED19,4,cluster_1/tuple_2:cc_python_2_27:cc_python_27_5:cc_python_5,cluster_1,mi_vs_tokens,mi,tokens,Yes,tokens
UE064AED19,2,8,V1,V1 was generally more succinct than V2 for all problems.,UE064AED19,8,cluster_3/tuple_16:cc_python_16_19:cc_python_19_23:cc_python_23,cluster_3,logprob_vs_tokens,logprob,tokens,Yes,tokens
UE064AED19,3,41,V2,V2 led to a much nicer solution to P1.,UE064AED19,41,cluster_9/tuple_17:cc_python_17_16:cc_python_16_19:cc_python_19,cluster_9,mi_vs_tokens,mi,tokens,No,tokens
UE064AED19,4,1,V1,"V1's helpers seemed more targeted (e.g. is_spruce), and V2 again did some questionable things like redefining `input`.",UE064AED19,1,cluster_0/tuple_29:cc_python_29_19:cc_python_19_13:cc_python_13,cluster_0,mi_vs_tokens,mi,tokens,Yes,tokens
UE064AED19,5,18,EG,These versions seemed essentially identical to me.,UE064AED19,18,cluster_4/tuple_8:cc_python_8_9:cc_python_9_3:cc_python_3,cluster_4,mi_vs_logprob,mi,logprob,Yes,EG
UE064AED19,6,43,V1,"I had a preference for how V1 decomposed and recomposed helpers, for example by using topo_min(n, reverse_edges(edges)) in P3.",UE064AED19,43,cluster_9/tuple_8:cc_python_8_10:cc_python_10_20:cc_python_20,cluster_9,mi_vs_logprob,mi,logprob,Yes,logprob
UE064AED19,7,13,V1,"While both have similar helpers, only V1 uses them well to produce succinct solutions.",UE064AED19,13,cluster_3/tuple_7:cc_python_7_29:cc_python_29_0:cc_python_0,cluster_3,mi_vs_tokens,mi,tokens,Yes,tokens
UE064AED19,8,22,EG,The solutions were essentially identical.,UE064AED19,22,cluster_5/tuple_28:cc_python_28_1:cc_python_1_19:cc_python_19,cluster_5,mi_vs_tokens,mi,tokens,Yes,EG
UE064AED19,9,30,V2,V2's solutions used the helpers to avoid major loop nesting in the main body of the program.,UE064AED19,30,cluster_6/tuple_19:cc_python_19_14:cc_python_14_7:cc_python_7,cluster_6,mi_vs_logprob,mi,logprob,No,logprob
UE064AED19,10,40,EG,These versions were essentially identical.,UE064AED19,40,cluster_8/tuple_28:cc_python_28_3:cc_python_3_29:cc_python_29,cluster_8,logprob_vs_tokens,logprob,tokens,Yes,EG
U7FC4E8A3C,1,29,V2,"I slightly prefer version 2 because the variable naming in 2 is slighly better. However, there are some things still to improve such as imports inside functions and doing import *. I also prefer get_top_n not using sort but instead using the heap as it should be faster",U7FC4E8A3C,29,cluster_6/tuple_12:cc_python_12_2:cc_python_2_11:cc_python_11,cluster_6,logprob_vs_tokens,logprob,tokens,Yes,logprob
U7FC4E8A3C,2,26,V1,i slightly prefer this from not having global variables MOD and BAD and putting more things in helper functions like the sort so it can be refactored / improved if needed,U7FC4E8A3C,26,cluster_5/tuple_5:cc_python_5_29:cc_python_29_7:cc_python_7,cluster_5,logprob_vs_tokens,logprob,tokens,Yes,tokens
U7FC4E8A3C,3,0,V1,i prefer more functionality being in the helper functions to be refactored / optimized as needed,U7FC4E8A3C,0,cluster_0/tuple_29:cc_python_29_19:cc_python_19_13:cc_python_13,cluster_0,mi_vs_logprob,mi,logprob,No,mi
U7FC4E8A3C,4,23,V1,"i prefer more being in the helper function file, slightly prefer not having magic constants however, there are still some issues like several magic numbers not exposed as arguments, ideally if there are magic numbers it would be good to have it as a parameter with default argument",U7FC4E8A3C,23,cluster_5/tuple_28:cc_python_28_1:cc_python_1_19:cc_python_19,cluster_5,logprob_vs_tokens,logprob,tokens,Yes,tokens
U7FC4E8A3C,5,13,V1,I prefer more concise main functions wtith good naming of subroutines,U7FC4E8A3C,13,cluster_3/tuple_7:cc_python_7_29:cc_python_29_0:cc_python_0,cluster_3,mi_vs_tokens,mi,tokens,Yes,tokens
U7FC4E8A3C,6,42,V1,i don't like the repeated code in version 2,U7FC4E8A3C,42,cluster_9/tuple_17:cc_python_17_16:cc_python_16_19:cc_python_19,cluster_9,logprob_vs_tokens,logprob,tokens,No,logprob
U7FC4E8A3C,7,10,V1,i slightly prefer the naming corresponding to what the solution represents vs what the underlying solution approach is,U7FC4E8A3C,10,cluster_3/tuple_6:cc_python_6_21:cc_python_21_9:cc_python_9,cluster_3,mi_vs_tokens,mi,tokens,No,mi
U7FC4E8A3C,8,44,V2,i dont really like dfs util it separates out the dfs logic too much without good naming or reason for it,U7FC4E8A3C,44,cluster_9/tuple_8:cc_python_8_10:cc_python_10_20:cc_python_20,cluster_9,logprob_vs_tokens,logprob,tokens,Yes,logprob
U7FC4E8A3C,9,20,V1,i don,U7FC4E8A3C,20,cluster_4/tuple_8:cc_python_8_9:cc_python_9_3:cc_python_3,cluster_4,logprob_vs_tokens,logprob,tokens,Yes,tokens
U7FC4E8A3C,10,37,V1,i dont like the extra code in main in version 2,U7FC4E8A3C,37,cluster_8/tuple_24:cc_python_24_15:cc_python_15_10:cc_python_10,cluster_8,logprob_vs_tokens,logprob,tokens,No,logprob
U33109D65F,1,1,V1,"Version 1 separated the most functionality into functions that were reused, as opposed to Version 2, which maintained copy-and-paste code. Also, Version 1 removed as much functionality from the main function as possible.",U33109D65F,1,cluster_0/tuple_29:cc_python_29_19:cc_python_19_13:cc_python_13,cluster_0,mi_vs_tokens,mi,tokens,Yes,tokens
U33109D65F,2,39,V2,Version 2 used more self-documenting functions such as sign_coeff. This breaks down longer and more convoluted lines into shorter lines that are more readable.,U33109D65F,39,cluster_8/tuple_28:cc_python_28_3:cc_python_3_29:cc_python_29,cluster_8,mi_vs_tokens,mi,tokens,No,tokens
U33109D65F,3,10,V1,V1's code was overall simpler and more readable. V2's code was a bit too complex,U33109D65F,10,cluster_3/tuple_6:cc_python_6_21:cc_python_21_9:cc_python_9,cluster_3,mi_vs_tokens,mi,tokens,Yes,tokens
U33109D65F,4,8,EG,Most of the differences between the two are down to preference.,U33109D65F,8,cluster_3/tuple_16:cc_python_16_19:cc_python_19_23:cc_python_23,cluster_3,logprob_vs_tokens,logprob,tokens,No,EG
U33109D65F,5,6,V2,"V2 was more modular with more functions that were each shorter compared to V1, which had longer and more confusing functions.",U33109D65F,6,cluster_2/tuple_5:cc_python_5_26:cc_python_26_22:cc_python_22,cluster_2,logprob_vs_tokens,logprob,tokens,No,tokens
U33109D65F,6,24,V2,V2's code is shorter and overall simpler.,U33109D65F,24,cluster_5/tuple_5:cc_python_5_29:cc_python_29_7:cc_python_7,cluster_5,mi_vs_logprob,mi,logprob,No,logprob
U33109D65F,7,17,EG,"They're essentially identical except for some small naming changes and line breaks vs semicolons, which are both down to preference.",U33109D65F,17,cluster_4/tuple_28:cc_python_28_4:cc_python_4_11:cc_python_11_good,cluster_4,logprob_vs_tokens,logprob,tokens,Yes,EG
U33109D65F,8,23,V2,Version 1 duplicated the same constant values that could've only been set once. Overall Version 2 is cleaner.,U33109D65F,23,cluster_5/tuple_28:cc_python_28_1:cc_python_1_19:cc_python_19,cluster_5,logprob_vs_tokens,logprob,tokens,Yes,logprob
U33109D65F,9,27,V2,V2 uses a heap library for an overall cleaner implemenation.,U33109D65F,27,cluster_6/tuple_12:cc_python_12_2:cc_python_2_11:cc_python_11,cluster_6,mi_vs_logprob,mi,logprob,No,logprob
U33109D65F,10,12,EG,The versions are very similar despite some naming differences,U33109D65F,12,cluster_3/tuple_7:cc_python_7_29:cc_python_29_0:cc_python_0,cluster_3,mi_vs_logprob,mi,logprob,No,EG
UACF3BE15C,1,1,V2,Version 2 doesn't have nested control structures,UACF3BE15C,1,cluster_0/tuple_29:cc_python_29_19:cc_python_19_13:cc_python_13,cluster_0,mi_vs_tokens,mi,tokens,Yes,mi
UACF3BE15C,2,6,V2,"Version 2 isn't good but version 1 is just terrible: compute_scc_zero_incoming has unclear meaning, is only used once, and contains weirdly named subfunctions like `dfs1` and `dfs2`.",UACF3BE15C,6,cluster_2/tuple_5:cc_python_5_26:cc_python_26_22:cc_python_22,cluster_2,logprob_vs_tokens,logprob,tokens,No,tokens
UACF3BE15C,3,36,V1,"I think ""binomial"" has clearer intention than ""nCr"". Also ""product_mod"" is reused a lot of times in version 2, which is good.",UACF3BE15C,36,cluster_8/tuple_24:cc_python_24_15:cc_python_15_10:cc_python_10,cluster_8,mi_vs_logprob,mi,logprob,Yes,logprob
UACF3BE15C,4,9,V1,"Both are terrible because the helper functions are not reused (and ""read_ints"" wasn't used at all!), but ""max_weighted_path"" is more generic than ""leaf_dp_max_gas"" whose name is tied to a specific problem.",UACF3BE15C,9,cluster_3/tuple_6:cc_python_6_21:cc_python_21_9:cc_python_9,cluster_3,mi_vs_logprob,mi,logprob,Yes,logprob
UACF3BE15C,5,17,V1,Version 1 uses math.hypot to compute the Euclidean norm.,UACF3BE15C,17,cluster_4/tuple_28:cc_python_28_4:cc_python_4_11:cc_python_11_good,cluster_4,logprob_vs_tokens,logprob,tokens,No,logprob
UACF3BE15C,6,3,V1,"Version 1 contains fewer direct operations on arrays, which are confusing and a sign of poor abstraction.",UACF3BE15C,3,cluster_1/tuple_2:cc_python_2_27:cc_python_27_5:cc_python_5,cluster_1,mi_vs_logprob,mi,logprob,Yes,logprob
UACF3BE15C,7,24,V1,"The functions ""find_longest_border"" and ""count_dp"" are very application-specific and not reusable.",UACF3BE15C,24,cluster_5/tuple_5:cc_python_5_29:cc_python_29_7:cc_python_7,cluster_5,mi_vs_logprob,mi,logprob,Yes,logprob
UACF3BE15C,8,28,EG,Essentially the same.,UACF3BE15C,28,cluster_6/tuple_12:cc_python_12_2:cc_python_2_11:cc_python_11,cluster_6,mi_vs_tokens,mi,tokens,Yes,EG
UACF3BE15C,9,13,V1,"Version 2 contains tons of non-reusable functions like ""parorder"", ""tree_reroot"", ""tree_dp_balance"", and ""can_satisfy""",UACF3BE15C,13,cluster_3/tuple_7:cc_python_7_29:cc_python_29_0:cc_python_0,cluster_3,mi_vs_tokens,mi,tokens,No,mi
UACF3BE15C,10,20,V1,"Functions like ""sorted_tuple"" and ""counter"" are reused multiple times.",UACF3BE15C,20,cluster_4/tuple_8:cc_python_8_9:cc_python_9_3:cc_python_3,cluster_4,logprob_vs_tokens,logprob,tokens,No,logprob
U80A4E7CD4,1,15,V2,"- V2 directly counts intersecting pairs with cnt * (total - cnt), while V1 subtracts non-intersecting from total pairs (less efficient)
- V2 has cleaner functions like compute_line_key() that do everything in one call, V1 splits logic across multiple functions
- V2 keeps identical code for problems 2 and 3, V1 has unnecessary differences",U80A4E7CD4,15,cluster_4/tuple_28:cc_python_28_4:cc_python_4_11:cc_python_11_good,cluster_4,mi_vs_logprob,mi,logprob,No,logprob
U80A4E7CD4,2,21,V2,"- V2 has cleaner function names like get_run_max() and merge_counts() that clearly describe what they do, while V1 uses cryptic names like cnt() and nxt()",U80A4E7CD4,21,cluster_5/tuple_28:cc_python_28_1:cc_python_1_19:cc_python_19,cluster_5,mi_vs_logprob,mi,logprob,Yes,mi
U80A4E7CD4,3,42,V1,"V1 fixes a major bug in Problem 1. The two-hop path algorithm needs to track which edge was used to reach each intermediate node, but V2's approach with last_w array gets overwritten and gives wrong costs. V1 correctly stores the edge weights in a temporary array during exploration.",U80A4E7CD4,42,cluster_9/tuple_17:cc_python_17_16:cc_python_16_19:cc_python_19,cluster_9,logprob_vs_tokens,logprob,tokens,Yes,tokens
U80A4E7CD4,4,29,V1,V1 uses the more standard heapq.nlargest() for selecting top operations which is clearer than V2's manual sorting approach.,U80A4E7CD4,29,cluster_6/tuple_12:cc_python_12_2:cc_python_2_11:cc_python_11,cluster_6,logprob_vs_tokens,logprob,tokens,No,logprob
U80A4E7CD4,5,25,V2,"V2 has cleaner, more focused functions. The compress function is a proper utility that does one thing well, while V1's coordinate compression is mixed into the main logic. V2's z_function is a standard implementation, whereas V1's compute_z and find_longest_border are overly complex for what they do.",U80A4E7CD4,25,cluster_5/tuple_5:cc_python_5_29:cc_python_29_7:cc_python_7,cluster_5,mi_vs_tokens,mi,tokens,No,tokens
U80A4E7CD4,6,37,V2,"V2 simplifies binpow by just using Python's built-in pow function, removing unnecessary custom implementation.",U80A4E7CD4,37,cluster_8/tuple_24:cc_python_24_15:cc_python_15_10:cc_python_10,cluster_8,logprob_vs_tokens,logprob,tokens,No,tokens
U80A4E7CD4,7,13,V2,"V2 has much better abstraction with specialized functions like tree_reroot, tree_dp_balance, and can_satisfy that encapsulate complex algorithms, making the main functions very clean and readable. V1 has all the logic inline, making it harder to understand and reuse.",U80A4E7CD4,13,cluster_3/tuple_7:cc_python_7_29:cc_python_29_0:cc_python_0,cluster_3,mi_vs_tokens,mi,tokens,No,tokens
U80A4E7CD4,8,2,V2,Extracted input reading into helper functions and replaced stack-based postorder with BFS approach.,U80A4E7CD4,2,cluster_0/tuple_29:cc_python_29_19:cc_python_19_13:cc_python_13,cluster_0,logprob_vs_tokens,logprob,tokens,No,tokens
U80A4E7CD4,9,30,V1,v2 fixes the logic with subset_size_sum_counts that properly excludes elements and handles the factorial calculations correctly.,U80A4E7CD4,30,cluster_6/tuple_19:cc_python_19_14:cc_python_14_7:cc_python_7,cluster_6,mi_vs_logprob,mi,logprob,Yes,logprob
U80A4E7CD4,10,43,V2,"v2 breaks down complex operations into simpler, focused functions like dfs_fill_order, dfs_mark, and compute_min_label.
v2 also has cleaner separation of concerns with build_graph handling input parsing and graph construction uniformly across programs.",U80A4E7CD4,43,cluster_9/tuple_8:cc_python_8_10:cc_python_10_20:cc_python_20,cluster_9,mi_vs_logprob,mi,logprob,Yes,mi
U4ED6E8EA5,1,31,V2,version 1 code seems to problem specific even though answers are shorter,U4ED6E8EA5,31,cluster_6/tuple_19:cc_python_19_14:cc_python_14_7:cc_python_7,cluster_6,mi_vs_tokens,mi,tokens,No,tokens
U4ED6E8EA5,2,19,V2,New functions are more useful; the refactorings in version 1 are named less usefully and some are trivial operations that don't need their own function (for clarity or brevity),U4ED6E8EA5,19,cluster_4/tuple_8:cc_python_8_9:cc_python_9_3:cc_python_3,cluster_4,mi_vs_tokens,mi,tokens,Yes,mi
U4ED6E8EA5,3,37,EG,"only notable difference I see are naming issues, but they are roughly equal (in v1, `binpow` is in fact a binary computation of power, but `prod` is a modulo product which is misleading. in v2, `binpow` uses built-in pow, so why name it binpow? but `product_mod` rightfully named).",U4ED6E8EA5,37,cluster_8/tuple_24:cc_python_24_15:cc_python_15_10:cc_python_10,cluster_8,logprob_vs_tokens,logprob,tokens,No,EG
U4ED6E8EA5,4,33,V1,"they both have a too-specific function (solve_small), and version 2 seems to have slightly better naming, but problem 3 is so overly verbose it has to lose",U4ED6E8EA5,33,cluster_7/tuple_11:cc_python_11_10:cc_python_10_27:cc_python_27,cluster_7,mi_vs_tokens,mi,tokens,No,mi
U4ED6E8EA5,5,4,V2,"very similar, but version 2 refactorings seem slightly less problem-specific",U4ED6E8EA5,4,cluster_1/tuple_2:cc_python_2_27:cc_python_27_5:cc_python_5,cluster_1,mi_vs_tokens,mi,tokens,No,tokens
U4ED6E8EA5,6,29,EG,Incredibly similar. P2+P3 nearly identical,U4ED6E8EA5,29,cluster_6/tuple_12:cc_python_12_2:cc_python_2_11:cc_python_11,cluster_6,logprob_vs_tokens,logprob,tokens,Yes,EG
U4ED6E8EA5,7,11,V1,version 2 refactors whole sol'n (basically) wholesale and the version 1 functions just seem more general,U4ED6E8EA5,11,cluster_3/tuple_6:cc_python_6_21:cc_python_21_9:cc_python_9,cluster_3,logprob_vs_tokens,logprob,tokens,No,logprob
U4ED6E8EA5,8,15,V1,"not only shorter without sacrificing legibility, but also finds the shared structure between p2 and p3: just submitting the same code",U4ED6E8EA5,15,cluster_4/tuple_28:cc_python_28_4:cc_python_4_11:cc_python_11_good,cluster_4,mi_vs_logprob,mi,logprob,Yes,logprob
U4ED6E8EA5,9,38,V2,"version 1 defines factorials which it never uses, otherwise very similar besides version 2's matching_count which is reasonable",U4ED6E8EA5,38,cluster_8/tuple_28:cc_python_28_3:cc_python_3_29:cc_python_29,cluster_8,mi_vs_logprob,mi,logprob,No,logprob
U4ED6E8EA5,10,7,V2,"par_depth_order calculates depth nearly for free, whereas the version 1 refactoring needs to add that logic separately",U4ED6E8EA5,7,cluster_3/tuple_16:cc_python_16_19:cc_python_19_23:cc_python_23,cluster_3,mi_vs_logprob,mi,logprob,Yes,mi
